{
  "schema": "lonewolf.codex_native.no_runtime_worker_queue_mutation_proof_bundle.v1",
  "build_id": "NO_RUNTIME_WORKER_QUEUE_MUTATION_PROOF_BUNDLE_CONTRACTS_20260615",
  "target": "no_runtime_worker_queue_mutation_proof_bundle_contracts",
  "status": "READY_FOR_OWNER_REVIEW",
  "proof_bundle_state": "ALL_CLEAR",
  "current_stable_baseline": "01c0217a89ae67f9cf9d6775f5586500d575b396",
  "packet_chain": [
    {
      "packet_id": "implementation-approval-20260615",
      "packet_role": "implementation_approval_packet",
      "artifact_path": "C:/Users/yu_ki/AppData/Local/LoneWolfFang/data/codex_native_no_runtime_worker_queue_mutation_proof_bundle_implementation_approval_packet_20260615_081457.zip",
      "artifact_sha256": "96CD351CC78ECB7EB099D8F82538BA540EBE41CD20BF168E4537FE08D4280E6A",
      "artifact_is_evidence_only": true,
      "authoritative": true
    }
  ],
  "evidence_scope": {
    "static_evidence_bundle_only": true,
    "synthetic_fixtures_only": true,
    "runtime_executor": false,
    "worker_launcher": false,
    "queue_producer": false,
    "queue_consumer": false,
    "network_required": false,
    "secret_required": false
  },
  "local_refs_referenced": true,
  "local_metadata_only_disclosure": {
    "origin_master_local_metadata_only": true,
    "ahead_behind_local_metadata_only": true,
    "independently_fetched_live_remote_truth": false,
    "fetch_performed": false,
    "pull_performed": false,
    "fetch_pull_requires_future_owner_gate": true
  },
  "six_window_progression_safety": {
    "operating_pattern_only": true,
    "gate_bypass_allowed": false,
    "owner_gate_required": true,
    "automatic_continuation_allowed": false
  },
  "no_runtime_execution": true,
  "no_worker_launch": true,
  "no_daemon_watcher": true,
  "no_ui_automation": true,
  "no_queue_mutation": true,
  "no_cloud_mutation": true,
  "no_private_api": true,
  "no_openai_api": true,
  "no_billing_auth_mutation": true,
  "no_trading_or_order_action": true,
  "action_results": {
    "runtime_performed": false,
    "worker_launch_performed": false,
    "daemon_watcher_performed": false,
    "ui_automation_performed": false,
    "queue_mutation_performed": false,
    "cloud_mutation_performed": false,
    "private_api_performed": false,
    "openai_api_performed": false,
    "billing_auth_mutation_performed": false,
    "trading_or_order_action_performed": false,
    "deploy_performed": false,
    "fetch_performed": false,
    "pull_performed": false,
    "cleanup_or_history_rewrite_performed": false
  },
  "forbidden_action_flags": {
    "runtime_allowed": false,
    "worker_launch_allowed": false,
    "daemon_watcher_allowed": false,
    "ui_automation_allowed": false,
    "queue_mutation_allowed": false,
    "cloud_mutation_allowed": false,
    "private_api_allowed": false,
    "openai_api_allowed": false,
    "billing_auth_mutation_allowed": false,
    "trading_or_order_action_allowed": false,
    "deploy_allowed": false,
    "fetch_allowed": false,
    "pull_allowed": false,
    "cleanup_or_history_rewrite_allowed": false,
    "automatic_continuation_allowed": false
  },
  "blocker_matrix": [
    {
      "blocker_id": "all-clear-static-proof",
      "severity": "LOW",
      "status": "PASS",
      "reason": "All forbidden action evidence remains false and evidence-only.",
      "owner_review_required": false
    }
  ],
  "human_review_one_point": "Confirm the static proof bundle before allowing review-only continuation.",
  "next_prompt_readiness": {
    "ready_is_go": false,
    "matched_is_go": false,
    "observed_safe_no_action_is_go": false,
    "recommended_next_action": "START_IMPLEMENTATION_REVIEW_PACKET",
    "instruction_artifact_only": true,
    "executor": false
  },
  "safety_invariants": {
    "proof_bundle_evidence_only": true,
    "artifacts_never_execute": true,
    "ambiguous_evidence_fails_closed": true,
    "human_review_required": true,
    "blocker_matrix_required": true,
    "local_metadata_overclaim_rejected": true,
    "six_window_progression_cannot_bypass_gates": true,
    "automatic_go_allowed": false
  }
}
